{
  "$schema": "https://json-schema.org/draft/2020-12/schema",
  "$id": "DatasetManifest.schema.json",
  "title": "DatasetManifest",
  "type": "object",
  "properties": {
    "schema_version": {
      "const": "1.0.0"
    },
    "synthetic": {
      "type": "boolean"
    },
    "dataset_id": {
      "type": "string"
    },
    "source": {
      "type": "string"
    },
    "release": {
      "type": "string"
    },
    "files": {
      "type": "array",
      "items": {
        "type": "object",
        "properties": {
          "name": {
            "type": "string"
          },
          "sha256": {
            "type": "string",
            "pattern": "^[a-f0-9]{64}$"
          },
          "size_bytes": {
            "type": "integer",
            "minimum": 0
          },
          "kind": {
            "enum": [
              "network",
              "process"
            ]
          }
        },
        "required": [
          "name",
          "sha256",
          "size_bytes",
          "kind"
        ],
        "additionalProperties": false
      }
    },
    "collection_range": {
      "type": "object",
      "properties": {
        "start": {
          "type": [
            "string",
            "null"
          ],
          "format": "date-time",
          "pattern": "^\\d{4}-\\d{2}-\\d{2}T\\d{2}:\\d{2}:\\d{2}(\\.\\d+)?(Z|[+-]\\d{2}:\\d{2})$"
        },
        "end": {
          "type": [
            "string",
            "null"
          ],
          "format": "date-time",
          "pattern": "^\\d{4}-\\d{2}-\\d{2}T\\d{2}:\\d{2}:\\d{2}(\\.\\d+)?(Z|[+-]\\d{2}:\\d{2})$"
        }
      },
      "required": [
        "start",
        "end"
      ],
      "additionalProperties": false
    },
    "timezone_basis": {
      "type": [
        "string",
        "null"
      ]
    },
    "authorization_ref": {
      "type": "string"
    }
  },
  "required": [
    "schema_version",
    "synthetic",
    "dataset_id",
    "source",
    "release",
    "files",
    "collection_range",
    "timezone_basis",
    "authorization_ref"
  ],
  "additionalProperties": false
}
