{"authorization_ref":"repository synthetic fixtures","collection_range":{"end":null,"start":null},"dataset_id":"dataset-30eebc238c24bd12f46a9fa84c021860b4f68299bab2d2a1dbf212dedadb2548","files":[{"kind":"network","name":"round7-legacy-0-bfedc284faa6b56d6ff4052da9bc5617c933e85e107ed46cbb9e0d65c56feb99.jsonl","sha256":"bfedc284faa6b56d6ff4052da9bc5617c933e85e107ed46cbb9e0d65c56feb99","size_bytes":543},{"kind":"process","name":"round7-legacy-1-d855c95ec145a538f84ec330290996425ec70ab3a12e58d1ad57df902d890666.csv","sha256":"d855c95ec145a538f84ec330290996425ec70ab3a12e58d1ad57df902d890666","size_bytes":153}],"release":"m1","schema_version":"1.0.0","source":"synthetic fixture","synthetic":true,"timezone_basis":null}
