{"authorization_ref":"explicit synthetic job opt-in","collection_range":{"end":null,"start":null},"dataset_id":"packet-dataset-d16c044914c628fab59d944a016b328a6d3680e7fb7bcdca6515241d5ea727fd","files":[{"kind":"network","name":"synthetic.pcap","sha256":"0c19a2724035d79fdfb202f452a93d21080b20b2dd313daa7e2313dc8321b23d","size_bytes":418},{"kind":"process","name":"process.csv","sha256":"d855c95ec145a538f84ec330290996425ec70ab3a12e58d1ad57df902d890666","size_bytes":153}],"release":"experimental-packet-1","schema_version":"1.0.0","source":"synthetic capture fixture","synthetic":true,"timezone_basis":null}
